<?xml version="1.0" encoding="UTF-8"?>
<!--
  ~ Copyright 2013 The Trustees of Indiana University
  ~
  ~ Licensed under the Apache License, Version 2.0 (the "License");
  ~ you may not use this file except in compliance with the License.
  ~ You may obtain a copy of the License at
  ~
  ~       http://www.apache.org/licenses/LICENSE-2.0
  ~
  ~ Unless required by applicable law or agreed to in writing, software
  ~ distributed under the License is distributed on an "AS IS" BASIS,
  ~ WITHOUT WARRANTIES OR CONDITIONS OF ANY KIND, either express or implied.
  ~ See the License for the specific language governing permissions and
  ~ limitations under the License.
  -->
<dcp xmlns="http://dataconservancy.org/schemas/dcp/1.0" xmlns:xsi="http://www.w3.org/2001/XMLSchema-instance"
  xsi:schemaLocation="http://dataconservancy.org/schemas/dcp/1.0 dcp.xsd ">
  <DeliverableUnits>
    <DeliverableUnit id="example:/DeliverableUnit/child">
        <title>DUtitle</title>
        <parent
                ref="example:/DeliverableUnit/parent" />
    </DeliverableUnit>
      <DeliverableUnit id="example:/DeliverableUnit/parent">
          <title>ParentDU</title>
      </DeliverableUnit>
  </DeliverableUnits>

  <Manifestations>
    <Manifestation id="example:/Manifestation/1">
      <deliverableUnit ref="example:/DeliverableUnit/child" />
      <manifestationFile ref="example:/File/Content/1" />
    </Manifestation>
  </Manifestations>
  <Files>
    <File id="example:/File/Content/1" src="/home/kavchand/Downloads/654">
      <fileName>fileName</fileName>
      <extant>true</extant>
    </File>
    </Files>
</dcp>

